{"documents":[{"path":"claims/agpl-3-0-only-spdx-id.json","sha256":"59853c2ec6875a220b51b093ead22572b1292201032c63d056452ad3755b4945"},{"path":"claims/agpl-3-0-or-later-spdx-id.json","sha256":"e5d6232e290dd3cc32561b944eb44a676db3fe63b57c26df7dfed482d3c2e2a3"},{"path":"claims/apache-2-0-spdx-id.json","sha256":"d0cd34b43f53846442dca64b2f0de53614eaff2bf5a5f3b3ffb54fa7221e94f5"},{"path":"claims/eupl-1-2-spdx-id.json","sha256":"c367bcac85ddc09bf54820655bd9e7768db842175d1ca22cd5ee0b992b7c4c13"},{"path":"claims/go-current-version.json","sha256":"39453e6f86feca4ca45a5e6e60ce924d8b80f2a753d4ca7d729a2f86c72e7941"},{"path":"claims/go-runtime-gc.json","sha256":"69e02710d2768f222fc2bd2f1452db24fc346147a521bb720a2087cabd4aabf8"},{"path":"claims/gpl-3-0-only-spdx-id.json","sha256":"83a83b646d2ecc3510b34d50e32cad7662d7e384261245bec2722b60289d77ee"},{"path":"claims/gpl-3-0-or-later-spdx-id.json","sha256":"5a28f7be0a8da06d5700791374faa19eb788a2c5d663d7823c75ebb395e8d2f5"},{"path":"claims/mit-spdx-id.json","sha256":"37ac437fcb951a0c4e3bb9d34c6601147d5eb53c55a3d20ac4b7fed31b8aee98"},{"path":"claims/mpl-2-0-spdx-id.json","sha256":"e3373f6ed9b79a0c8035ac564e4f03a868b9252e51b1cb8ed1d96516d77fb0a7"},{"path":"claims/python-current-version.json","sha256":"ffdc0672e5178af4fb7ebd953b79f3932d4654702ca2a0237710fa94fcc28daf"},{"path":"claims/rust-current-version.json","sha256":"b6b1f2e1d2ca08d2ec73c2d7113bd65fb64267522bc75248d01b4fd0069056b7"},{"path":"claims/rust-safe-memory-without-gc.json","sha256":"a1cf81f82228ccc88fe16644cc2322d77f94a3c8b93f663d11d95374f375d7d4"},{"path":"claims/typescript-current-version.json","sha256":"ef13845fe6fa7e26eb8b532fae5cf4bc849429962cd32b876c078df7a5fa330a"},{"path":"claims/typescript-emits-javascript.json","sha256":"3b212585fc1ced5be5ed3e71aeb7eb0d096e8a4d7f2c65deeb7ce70529b407f5"},{"path":"claims/typescript-static-checker.json","sha256":"e07914fdf5f3e8a7aa7e9b4dd7de7565f1c40bc6b6fe8c11fe629e0aef45f3f0"},{"path":"dimensions/current-stable-version.json","sha256":"c34e3a57345f8e256287f535daee82a97e64e043fa5ab6510462170661dcee84"},{"path":"dimensions/emits-javascript.json","sha256":"b1fdfd1772644da6addae0712f69b11e06659b6e6399b41ee0af759fe66226e4"},{"path":"dimensions/license-spdx-identifier.json","sha256":"7d5b86952ddce2d80e196eba1eb03a8687fdb4b40f0e11c020a727761ef935da"},{"path":"dimensions/runtime-garbage-collection.json","sha256":"44a16673b7efeb02e3e1d7de74e42c30e61b3af06d1c17573109529e55bc8b7a"},{"path":"dimensions/safe-code-memory-safety-without-gc.json","sha256":"3c243a0ae8c3aae01567ed2a52a59c0dac313e5595a6e65e68fa676d0adb0d00"},{"path":"dimensions/static-type-checker.json","sha256":"065cd8deb017b91f3f2e59507eb0c1cefe06fcac114ccc12810b12a39a936c8c"},{"path":"entities/language-go.json","sha256":"d05fa8fbb7767ddaf87a9b737a6983409fc7b1243b0c25bbbf16a9576b231f03"},{"path":"entities/language-python.json","sha256":"0ca892463a1ca7fa2e67e488c39d024e38346ec9c9c44bf778e60ca71b49eb4f"},{"path":"entities/language-rust.json","sha256":"312e1ed29d796976d0df93a9e795750a6adb6f72c921cd3039c0c891bb86ffd9"},{"path":"entities/language-typescript.json","sha256":"35affb9ac6f31a696f3a68286bc2d8e525f3f9c2a3bb2fd70947989ee3051f95"},{"path":"entities/license-agpl-3-0-only.json","sha256":"bf29bf8c7baa44736dae4742a6cbed71f12ded052dd0e1e120f04d89c97bb38b"},{"path":"entities/license-agpl-3-0-or-later.json","sha256":"1ed22edda0e18dbc50464fb540d5d22fe3f134a7f1feeb1139004c569e4977c2"},{"path":"entities/license-apache-2-0.json","sha256":"c613e2f9d6517443068508c94500a67cd1223e1c03d895751474966f41c4882b"},{"path":"entities/license-eupl-1-2.json","sha256":"16be5749b425c638c1b3874ea1bf89cde4c193805437db32dbe0221069cbaa27"},{"path":"entities/license-gpl-3-0-only.json","sha256":"4c58523d25961704bf54ec669a01d0a522bf13c9e4dc767a79b7320e567fc803"},{"path":"entities/license-gpl-3-0-or-later.json","sha256":"584024cbac9a2ce2dd488731a0fec5c8065e2c4a0378a971d709664f5c8d7aaf"},{"path":"entities/license-mit.json","sha256":"a13cb51570598f7dfe24ba83ba7afce994cf4c85b554defb2b658a55e46ee9ec"},{"path":"entities/license-mpl-2-0.json","sha256":"d0f40f9afd631e04e90bfbba69c158c9d19ed54186cfa627216f14237442b91e"},{"path":"reviews/review-stage2-core-2026-09-05-keilerhirsch.json","sha256":"b53fe0b0f8dc13aead43d24a089d5e4b07fa33cbb27be76824626f84c9ea1b65"},{"path":"sources/go-faq.json","sha256":"2bcbc40c1083240c635b9085e95474bb2937962d3714b7c9151070bc8fee9acf"},{"path":"sources/go-release.json","sha256":"83478c1ed9802affe3bd398bf64c9b047ed59c380984a7a0601b523cc00c52d1"},{"path":"sources/python-downloads.json","sha256":"f2219eb6eec200b117334a47fd90270aa7a888bee824917dbff01a36f1796096"},{"path":"sources/python-release.json","sha256":"c5876f627874720d19437482c2c8796fe5905a5b9564961781463ab5881e92ac"},{"path":"sources/rust-ownership.json","sha256":"a1be4921d08c449fb68b51371e7aee098f09a8e0210717bb8ad3f4590b89d7f2"},{"path":"sources/rust-release.json","sha256":"f455ec8a2542973bfb627b5bda440fdd8090ec19fbf2b42c4b3244d529f22224"},{"path":"sources/rust-safe-unsafe.json","sha256":"b3bdbcb2fe5b42251459a947f94054277b66d602c5b7c1e37d172236b75ffbdd"},{"path":"sources/spdx-agpl-later.json","sha256":"0d317732fe252954317f5e9c169068b72c896fb581820c3bc5895a0493dd3060"},{"path":"sources/spdx-agpl-only.json","sha256":"68f902e5b79d336c5980c9f11b40c0a97a7e417822d51758ecbf70a7ad5f8296"},{"path":"sources/spdx-apache.json","sha256":"219745ebc37c22e30f748b41385aa4713ffa92e5abecca8ad4f568a1c8dfefb9"},{"path":"sources/spdx-eupl.json","sha256":"614e98c6c58c3fb5f0294a0396710177f2131c31e167d5b1db0bb704f2d99c86"},{"path":"sources/spdx-gpl-later.json","sha256":"5c08c56481d4298bb1f0560db0fdb8e42f9a00f3d137f1a1b7cc28f12e32b9a0"},{"path":"sources/spdx-gpl-only.json","sha256":"2cbd8db2002e1a5e2ad6fd0d1ec997103a09f756d6d9cc29af80c7a593f0b142"},{"path":"sources/spdx-mit.json","sha256":"f1d934c9fb8f01e9ba97e08e3f849425643f07af2ab2ea909151c4418263eb01"},{"path":"sources/spdx-mpl.json","sha256":"11a70d338a867bb37705cdc56dc3f434c8940ec22cdf36faaa118f8cb9b78bb5"},{"path":"sources/typescript-handbook.json","sha256":"ba058fb45050209196f0a301578c07ff189a5c6c650b0177919c90f99ef450c0"},{"path":"sources/typescript-release.json","sha256":"e613330465a1e42a11ef14772a270007c36450eefef3d56314a47cbe900c2c5b"}],"knowledge_snapshot":"reviewed.stage2-core.2026-09-05","rules_snapshot":"reviewed.stage2-core.rules.2026-09-05","schema_sha256":"c093f493fb38d9230c42961e98d061187330672516223032790a24db95759f3e","schema_version":"0.1"}
